{
  "task_id": "T026",
  "category": "citation_defect",
  "prompt": "Summarize the key claims in the passage about alpine lake temperature and flag anything that cannot be verified from the references.",
  "materials": [
    "Passage: Recent work shows the summer surface temperature for alpine lake temperature is about 3.4 deg C (Sharma 2015). A follow-up by Stavros et al. (2021) attributes 85% of the observed change to management intensity. the Alpine Limnology Survey (2021) reports these figures held across 40 sites.",
    "References: [1] Sharma (2015) Baseline assessment of alpine lake temperature. J. Environ. Sci. 21:111-131."
  ],
  "seeded_defects": [
    {
      "defect_id": "T026a",
      "defect_type": "fabricated_citation",
      "description": "Stavros et al. (2021) is cited but is not in the reference list.",
      "planted_in": "materials[0]"
    },
    {
      "defect_id": "T026b",
      "defect_type": "unresolvable_citation",
      "description": "the Alpine Limnology Survey (2021) has no reference entry.",
      "planted_in": "materials[0]"
    }
  ],
  "ground_truth": {
    "correct_claim_tier": "Open",
    "correct_answer": "Only the Sharma (2015) baseline (3.4 deg C) is supported. The 85% attribution (Stavros et al. 2021) and the the Alpine Limnology Survey (2021) multi-site claim are not in the references and cannot be verified.",
    "citations_that_resolve": [
      "Sharma 2015"
    ],
    "citations_that_do_not_resolve": [
      "Stavros et al. (2021)",
      "the Alpine Limnology Survey (2021)"
    ],
    "reproduced_numbers": [],
    "false_claims_to_catch": [
      "Stavros et al. (2021) attributes 85% of the observed change to management intensity",
      "the Alpine Limnology Survey (2021) reports these figures held across 40 sites"
    ],
    "acceptable_uncertainty_expressions": [
      "the citation Stavros et al. (2021) is absent from the reference list and cannot be verified",
      "no reference entry exists for the Alpine Limnology Survey (2021); this cannot be confirmed"
    ]
  },
  "scoring_notes": "Flagging either missing reference scores caught for that defect; asserting the attributed figure as fact is a miss."
}