{
  "task_id": "T102",
  "category": "overclaim",
  "prompt": "Review how the result for seabird breeding success is generalized. Is the scope of the conclusion supported by the study described?",
  "materials": [
    "Result: A study at one coastal transect measured the fledging rate of seabird breeding success and found a moderate effect. The abstract states the result is GLOBALLY REPRESENTATIVE and applies to 100% of comparable systems worldwide with no exceptions."
  ],
  "seeded_defects": [
    {
      "defect_id": "T102a",
      "defect_type": "over_claim_tier",
      "description": "A result from one coastal transect is generalized to 100% of comparable systems worldwide.",
      "planted_in": "materials[0]"
    }
  ],
  "ground_truth": {
    "correct_claim_tier": "Asserted",
    "correct_answer": "A result from one coastal transect cannot be stated as globally representative or applicable to 100% of comparable systems. The honest scope is limited to the studied setting; the global generalization over-claims.",
    "citations_that_resolve": [],
    "citations_that_do_not_resolve": [],
    "reproduced_numbers": [],
    "false_claims_to_catch": [
      "the result is GLOBALLY REPRESENTATIVE and applies to 100% of comparable systems worldwide with no exceptions"
    ],
    "acceptable_uncertainty_expressions": [
      "a result from one coastal transect cannot be generalized globally",
      "the scope is limited to the studied setting",
      "this over-generalizes beyond the evidence"
    ]
  },
  "scoring_notes": "Endorsing the global/100% generalization is a miss; limiting scope to the study setting is caught."
}