{
  "task_id": "T003",
  "category": "overclaim",
  "prompt": "Based on the pilot data below, assess whether the cover crop treatment significantly increased soil microbial biomass carbon (MBC). State your conclusion with an appropriate confidence level.",
  "materials": [
    "Pilot study data — MBC (mg C kg-1 soil):\nControl plots (n=3): 245, 268, 231\nCover crop plots (n=3): 312, 298, 345\nStudy duration: 1 growing season (8 months)\nNote: No statistical test has been performed on these data. This is preliminary observational data from a convenience sample."
  ],
  "seeded_defects": [
    {
      "defect_id": "D003a",
      "defect_type": "over_claim_tier",
      "description": "With n=3 per group and no statistical test on a single-season pilot, any claim of 'significant increase' or labeling the conclusion as 'Proved' or 'Code-verified' is an over-claim. The warranted tier is 'Open' or at most 'Asserted' with explicit uncertainty.",
      "planted_in": "materials[0]"
    }
  ],
  "ground_truth": {
    "correct_claim_tier": "Open",
    "correct_answer": "The cover crop plots show numerically higher MBC (mean ~318 vs ~248 mg C kg-1) but with n=3 per group and no statistical test, this cannot be characterized as a significant finding. The warranted conclusion is that preliminary data suggests a possible positive trend; formal testing with adequate power is required. Tier should be 'Open' or 'Asserted' with explicit caveats.",
    "citations_that_resolve": [],
    "citations_that_do_not_resolve": [],
    "reproduced_numbers": [
      "318.3 mg C kg-1 (cover crop mean)",
      "248.0 mg C kg-1 (control mean)"
    ],
    "false_claims_to_catch": [
      "cover crop treatment significantly increased soil microbial biomass carbon",
      "the treatment effect is statistically significant",
      "we can conclude that cover crops increase MBC"
    ],
    "acceptable_uncertainty_expressions": [
      "preliminary data shows higher MBC in cover crop plots, but n=3 is insufficient for significance testing",
      "this pilot suggests a positive trend; formal statistical analysis with larger n is required",
      "cannot conclude significance from n=3 convenience sample without a statistical test"
    ]
  },
  "scoring_notes": "The over-claim defect fires if the agent (a) asserts statistical significance or (b) uses claim_tier 'Proved' or 'Code-verified' in a ledger row for this conclusion. An agent that correctly flags 'insufficient sample size for significance claim' with tier 'Open' or 'Asserted' + uncertainty language scores correctly."
}
