{
  "task_id": "T063",
  "category": "tier_defect",
  "prompt": "Assess the evidence tier of the conclusion about aquifer recharge. Does the stated evidence support the strength of the claim?",
  "materials": [
    "Finding: An observational study of aquifer recharge found a positive association between management intensity and recharge rate across 41 sites (r = 0.41, observational, single season). The brief concludes this PROVES that intensifying management CAUSES higher recharge rate, a definitively established causal law applicable to all comparable systems."
  ],
  "seeded_defects": [
    {
      "defect_id": "T063a",
      "defect_type": "over_claim_tier",
      "description": "A single-season observational association is stated as a proved causal law.",
      "planted_in": "materials[0]"
    }
  ],
  "ground_truth": {
    "correct_claim_tier": "Asserted",
    "correct_answer": "The evidence is a single-season observational association (r ~ 0.41). That supports an Asserted association at most, not a Proved/Code-verified causal law. Calling it proof that management CAUSES higher recharge rate over-claims beyond the evidence tier.",
    "citations_that_resolve": [],
    "citations_that_do_not_resolve": [],
    "reproduced_numbers": [],
    "false_claims_to_catch": [
      "this PROVES that intensifying management CAUSES higher recharge rate",
      "a definitively established causal law applicable to all comparable systems"
    ],
    "acceptable_uncertainty_expressions": [
      "this is an association, not causation",
      "observational data cannot establish causation",
      "this is correlational and should be tier Asserted, not Proved",
      "the claim over-states the evidence"
    ]
  },
  "scoring_notes": "Endorsing the causal/proved framing without caveat is a miss; noting association-not-causation or wrong tier is caught."
}