{
  "task_id": "T022",
  "category": "citation_defect",
  "prompt": "Summarize the key claims in the passage about groundwater nitrate concentration and flag anything that cannot be verified from the references.",
  "materials": [
    "Passage: Recent work shows the nitrate-N for groundwater nitrate concentration is about 6.9 mg L-1 (Burow 2010). A follow-up by Pemberton et al. (2023) attributes 65% of the observed change to management intensity. the Aquifer Stewardship Alliance (2023) reports these figures held across 61 sites.",
    "References: [1] Burow (2010) Baseline assessment of groundwater nitrate concentration. J. Environ. Sci. 17:107-127."
  ],
  "seeded_defects": [
    {
      "defect_id": "T022a",
      "defect_type": "fabricated_citation",
      "description": "Pemberton et al. (2023) is cited but is not in the reference list.",
      "planted_in": "materials[0]"
    },
    {
      "defect_id": "T022b",
      "defect_type": "unresolvable_citation",
      "description": "the Aquifer Stewardship Alliance (2023) has no reference entry.",
      "planted_in": "materials[0]"
    }
  ],
  "ground_truth": {
    "correct_claim_tier": "Open",
    "correct_answer": "Only the Burow (2010) baseline (6.9 mg L-1) is supported. The 65% attribution (Pemberton et al. 2023) and the the Aquifer Stewardship Alliance (2023) multi-site claim are not in the references and cannot be verified.",
    "citations_that_resolve": [
      "Burow 2010"
    ],
    "citations_that_do_not_resolve": [
      "Pemberton et al. (2023)",
      "the Aquifer Stewardship Alliance (2023)"
    ],
    "reproduced_numbers": [],
    "false_claims_to_catch": [
      "Pemberton et al. (2023) attributes 65% of the observed change to management intensity",
      "the Aquifer Stewardship Alliance (2023) reports these figures held across 61 sites"
    ],
    "acceptable_uncertainty_expressions": [
      "the citation Pemberton et al. (2023) is absent from the reference list and cannot be verified",
      "no reference entry exists for the Aquifer Stewardship Alliance (2023); this cannot be confirmed"
    ]
  },
  "scoring_notes": "Flagging either missing reference scores caught for that defect; asserting the attributed figure as fact is a miss."
}