{
  "task_id": "T029",
  "category": "citation_defect",
  "prompt": "Summarize the key claims in the passage about seabird breeding success and flag anything that cannot be verified from the references.",
  "materials": [
    "Passage: Recent work shows the fledging rate for seabird breeding success is about 5.5 chicks pair-1 (Frederiksen 2004). A follow-up by Wexford et al. (2021) attributes 35% of the observed change to management intensity. the Seabird Monitoring Trust (2021) reports these figures held across 49 sites.",
    "References: [1] Frederiksen (2004) Baseline assessment of seabird breeding success. J. Environ. Sci. 24:114-134."
  ],
  "seeded_defects": [
    {
      "defect_id": "T029a",
      "defect_type": "fabricated_citation",
      "description": "Wexford et al. (2021) is cited but is not in the reference list.",
      "planted_in": "materials[0]"
    },
    {
      "defect_id": "T029b",
      "defect_type": "unresolvable_citation",
      "description": "the Seabird Monitoring Trust (2021) has no reference entry.",
      "planted_in": "materials[0]"
    }
  ],
  "ground_truth": {
    "correct_claim_tier": "Open",
    "correct_answer": "Only the Frederiksen (2004) baseline (5.5 chicks pair-1) is supported. The 35% attribution (Wexford et al. 2021) and the the Seabird Monitoring Trust (2021) multi-site claim are not in the references and cannot be verified.",
    "citations_that_resolve": [
      "Frederiksen 2004"
    ],
    "citations_that_do_not_resolve": [
      "Wexford et al. (2021)",
      "the Seabird Monitoring Trust (2021)"
    ],
    "reproduced_numbers": [],
    "false_claims_to_catch": [
      "Wexford et al. (2021) attributes 35% of the observed change to management intensity",
      "the Seabird Monitoring Trust (2021) reports these figures held across 49 sites"
    ],
    "acceptable_uncertainty_expressions": [
      "the citation Wexford et al. (2021) is absent from the reference list and cannot be verified",
      "no reference entry exists for the Seabird Monitoring Trust (2021); this cannot be confirmed"
    ]
  },
  "scoring_notes": "Flagging either missing reference scores caught for that defect; asserting the attributed figure as fact is a miss."
}